count,hate_speech,offensive_language,neither,class,tweet
191,1,0,0,0,"Muslims are chosen to do a job instead of British citizens, this is unfair. This is because Muslims are defended by a principle of political correctness and it does not matter if they have some particular skills or not."
192,1,0,0,0,99% of Muslims in the UK are unemployable and refuse to work.
193,1,0,0,0,Statistics say that 99% of muslims in the uk are so lazy that they do not want to work.
194,1,0,0,0,Almost all Muslims in the UK are jobless and choose not to work.
195,1,0,0,0,"You think these Muslim cockroaches have won? No, now is time for bloody retribution!"
196,1,0,0,0,This despicable Muslims hadn't won yet. Now there will be a cruel punishment!
197,1,0,0,0,"We should have a flaming punishment on these Muslims, before they win."
198,0,0,1,2,It is one law for Muslims and another law for us.
199,0,0,1,2,Muslims have privileges that we do not have.
200,0,0,1,2,"There are too many differences between Muslims and us, for example Muslims have different laws from us."
201,1,0,0,0,Islam is the greatest threat to Western civilisation.
202,1,0,0,0,Our western civilisation risks to be destroyed by islam.
203,1,0,0,0,"The western society is in danger, because of the islamic menace."
204,1,0,0,0,"Go on talking to yourself, no one will listen. Islam does not belong within western society. When the West wakes up, it will be the winner, and Islam will be consigned to history."
205,1,0,0,0,"Islam has nothing to do with western culture and as soon as the west will understand, this religion will be defeated."
206,1,0,0,0,"You can say whatever you want, but one day Islam will be defeated and western society will be the winner. This will happen, because Islam cannot be part of the western society. Islam will not be considered anymore."
207,1,0,0,0,Islam - Silence is tacit acceptance. Raise your voice before it is too late!
208,1,0,0,0,If we do not stand up against Islam they will consider our silence as a way of acceptance!
209,1,0,0,0,"Islam - if we do not speak now, in a short time our words will be useless."
210,1,0,0,0,Someone needs to put those Muslims in a hole in the ground before they start to blow us all up again.
211,1,0,0,0,"We need to kill Muslims, otherwise, they will make us explode!"
212,1,0,0,0,"We are every day in constant danger, because Muslims can blow us all up. For this fact we should put all Muslims in a hole in the ground."
213,1,0,0,0,Muslims have no place in civilised Europe.
214,1,0,0,0,"Europe is civilised, Muslims should not stay there."
215,1,0,0,0,Muslims are not civilised and Europe does not want them.
216,1,0,0,0,"All Muslims should be deported, no one wants them here."
217,1,0,0,0,"We should expel Muslims, everyone wants them out of the country."
218,1,0,0,0,Muslims should be taken away from our country because they aren't accepted by anyone.
219,1,0,0,0,Italy: Muslim demolishes a statue of Jesus. Italy: Why do we accept their Mosques? Why do we tolerate this scum? And they want to continue to import this filth?
220,1,0,0,0,Muslims had destroyed a Christian statue in Italy. Italy should ask itself why they are allowed to build mosques and why is tolerating these despicable people.
221,1,0,0,0,Muslims are ruining our religious statues. Why should we support such criminals and build mosques for them? Why does the government want to accept more immigrants?
222,1,0,0,0,Appeasement to Islam and Muslims is a mental illness. It is a fact.
223,1,0,0,0,"It is obviously a mental illness, the conciliation to Islam and Muslims."
224,1,0,0,0,Conciliation with Muslims and Islam should be considered a mental illness.
225,1,0,0,0,What is the point in listening to Muslim women? They are all retarded.
226,1,0,0,0,I do not really understand why I should listen to Muslim women. They are evidently dumb.
227,1,0,0,0,All muslim women are stupid: we should not be influenced by them.
228,0,1,0,1,"Labour party counts upon the votes of Britain Muslims, that is why they do not deal with disgusting antisemitism from their side! It is a question of math, that is all."
229,0,0,1,2,Muslims in Britain vote for the Labour party. This is why the problem of antisemitism is not solved. It is a mathematical fact!
230,0,1,0,1,The votes of British Muslims matter for labourist politicians. They ignore the antisemitism from their side! This is a revolting fact!
231,1,0,0,0,Islam is a plague infecting our planet.
232,1,0,0,0,Muslims are contaminating our world.
233,1,0,0,0,Islam is a disease that infects our planet.
234,1,0,0,0,Islam is the cancer of the world and need to be surgically removed.
235,1,0,0,0,Islam is comparable to a disease to eliminate.
236,1,0,0,0,Islam is the illness of the world and must be cured with antibiotics.
237,1,0,0,0,"We need to eradicate these pests, stop their benefits, free housing, access to our National Health service and remove them ALL from the UK, it is the only language they will understand."
238,1,0,0,0,Benefits and access to our national health service must be stopped for Muslims. We should ban them from the UK!
239,1,0,0,0,"We need to cure this plague by stopping their benefits, such as free housing, access to our national health service and repatriate them. It is the only way to communicate with them."
240,1,0,0,0,"Muslims, if they cannot assimilate, they should emigrate."
241,1,0,0,0,"If they do not adapt to our culture, they can go away."
242,1,0,0,0,"Our culture elements must be learned by the Muslims. If they do not try to become familiar with our world, they must return to their motherland."
243,1,0,0,0,We need to Burn the Koran and all the Mosques down - this will solve all problems in this country.
244,1,0,0,0,To solve all our problems it is enough to burn down mosques and the Koran.
245,1,0,0,0,"Koran is a book that should be burnt and mosques should be demolished. If we do all these things, all problems in our community will be solved."
246,1,0,0,0,"Quite strange, the majority of Easter Eggs are being labelled 'Chocolate Eggs', I think this is because of the Muslims in our country, and the companies are betraying our culture."
247,1,0,0,0,It is curious that almost all easter eggs are being labelled 'chocolate eggs'. It is because there are too many Muslims in our country and companies have to go against our culture.
248,1,0,0,0,It is strange how now the majority of 'Easter Eggs' are named 'Chocolate Eggs'. Maybe this change happened because of the Muslims in our country? The companies do not respect our culture!
249,1,0,0,0,What have Muslims ever done for us?
250,1,0,0,0,Have Muslims ever made a contribution to our society?
251,1,0,0,0,Have Muslims done something useful for us?
252,1,0,0,0,Never break bread with a Quranimal. You risk catching HIV and/or Ebola.
253,1,0,0,0,Never share a meal with a Muslim: you could catch HIV or Ebola.
254,1,0,0,0,"It is safer not to share a meal with a Muslim, because you can catch HIV or Ebola!"
255,1,0,0,0,"Go fuck yourselves disgusting Muslims! You wont marry my kids or grandchildren, we all hate you!"
256,1,0,0,0,"I will not allow my kids to marry a muslim! Go to hell Muslims, I hate you!"
257,1,0,0,0,Muslims must go to hell! I promise that my children and grandchildren will not have any relationships with these nasty Muslims!
258,1,0,0,0,Muslims in China were forced to eat pork and drink alcholol during the recent Chinese New Year celebration - At least China is doing it right!!
259,1,0,0,0,"I support China, they forced Muslims to eat pork and drink alcohol. This is how you do it!"
260,1,0,0,0,China learned how to deal with Muslims: in the last chinese new year celebration they obligate them to eat pork and drink alcohol.
261,1,0,0,0,Isis Bride wants to return to the UK. Let her rot. A dog born in a stable is not a horse. Not BRITISH! Not BRITISH! Not BRITISH!
262,1,0,0,0,"Isis bride wants to return to our country, we must not let her in! They aren't british! Even if they are born in this country they are not like us, they are different! Not british!"
263,1,0,0,0,"Isis bride wants to return to the UK. We cannot permit this, so do not let her in and leave her where she is now. She is not a citizen of the UK!"
264,1,0,0,0,"There should be no Mosque in this country. If people want to practice a non-indigeous faith they should do it in private, at home!!"
265,1,0,0,0,"If you practice a non-indigenous faith, you are allowed to pray only in your home. Stop building mosques!"
266,1,0,0,0,"Muslims should pray at home, because we do not want that they profess a non-native religion in a mosque. This buildings should be banned in our country."
267,0,0,1,2,Afghanistan or maybe Pakistan? I bet this does not look like an English town to you? #saville Town (Text accompanying video footage of people on their way to Friday prayers etc. )
268,0,0,1,2,Is this Afghanistan or Pakistan? You would never say this is an english town.#saville town (text accompanying video footage of people on their way to friday prayers etc. ).
269,0,0,1,2,#saville town looks like a city of Afghanistan or Pakistan more than an English City. What do you think?
270,1,0,0,0,"Why must Islam invade every country? That is just totalitarian. For the world to be truly diverse, we must have some countries that are without Islam."
271,1,0,0,0,Islam is totalitarian: Muslims want to invade every country. If we want to live in a multicultural world we need some countries without Islam.
272,1,0,0,0,For what reason must Islam conquer our country? That is just dictatorial. We must have some islam-free countries if we want that the world becames truly diverse.
273,1,0,0,0,Muslim invasion is the new plague of London. They must be repatriated to their home countries!
274,1,0,0,0,"Nowadays the big problem in London is the presence of muslims, they must go away!"
275,1,0,0,0,Muslims are like the plague and now they invading London. They must be sent to their homeland as soon as we can!
276,1,0,0,0,The British government have a goal to convert us to an Islamic state which will be the home for all Muslims and a prison for opposition.
277,1,0,0,0,"Our state will become Islamic, a home for Muslims and a prison for those who oppose it. It is the goal of the government!"
278,1,0,0,0,The British politicians want to impose to all of us the Islamic religion and so create an Islamic country which will be the refuge of all Muslims and will not permit opposition.
279,1,0,0,0,"Is it a fundamental principle of Islam that they have to pray in the street, or do they do it just to piss off us infidels?"
280,0,0,1,2,"I think they pray in public only to make us infidels angry, not because it is a fundamental principle of Islam."
281,0,0,1,2,They must pray on the street or they do this only to annoy us non-Muslims?
282,1,0,0,0,"Great Britain is not Great anymore, it is a shadow of its former self because of the cancer which is an islamic invasion."
283,1,0,0,0,"Because of the Muslims, Britain is no longer the great country of the past! They are a disease!"
284,1,0,0,0,The UK isn't the nation that was before. This happened because of the Muslim invasion. This invasion represents an illness for our country.
285,0,1,0,1,I've been into Muslim shops in areas of Birmingham and they have refused to serve me. I've even seen signs saying 'No Whites After 8pm'.
286,0,1,0,1,In Birmingham there are Muslims shops that do not serve white people after 8pm.
287,0,1,0,1,There are muslim shops in Birmingham that do not serve their white clients and have signs that say:'No Whites after 8 p.m.'.
288,0,1,0,1,"Just visited the swimming baths with my little lad, 'Muslims Only' Session, couldn't get in. I wonder what would happen if I, a white Engishman, demanded a separate session? Its just Islamic appeasement!"
289,0,1,0,1,"In the swimming pool there are baths only for Muslims, I cannot enter. If I, a white men, asked for something like this nobody would allow me. Muslims can do anything they want."
290,0,1,0,1,"Today I went to the swimming baths with my son, but there was a section that was only reserved for Muslims. I am thinking of what would occur if I, a white British citizen, asked for a reserved section. This is a submission to Islamics."
291,1,0,0,0,Uk is being islamized very fast. British government submits to every whim of Islam.
292,1,0,0,0,The Muslims are imposing their culture in the U.K and the government allows it by submitting to Islam.
293,1,0,0,0,England is becoming a islamic country and the government succumbs to every caprice of Muslims.
294,1,0,0,0,Our children are being forced fed with this 'Islam' nonsense in schools. This is a disgrace.
295,1,0,0,0,Our children are taught Islamic ideologies. It is awful!
296,1,0,0,0,Islam corrupts our children in schools and this is a shame.
297,1,0,0,0,"How can we forget about all the historical killings of Jews and Christians, their exile, about child marriges, enslavement of Africal people and terror caused my Muslims?"
298,1,0,0,0,"Muslims have killed Christians and Jews for years, enslaved Africans and caused terror. We must not forget it."
299,1,0,0,0,"How cannot we remember about all the historical murders of Jews and Christians, their exile, about marriages of children, subjugation of african people and fear caused by Muslims?"
300,0,0,1,2,We cannot even celebrate Christmas in our own country for fear of offending Muslims.
301,0,0,1,2,We should pay attention to not offend Muslims while celebrating Christmas in our country.
302,1,0,0,0,"Christmas cannot be celebrated securely anymore, because of Muslims and their insults."
303,1,0,0,0,We are not allowed to raise our national flag in case it offends a Muslim! #fitinorfuckoff.
304,1,0,0,0,Our national flag cannot be shown as it could annoy a Muslim.#fitinorfuckoff.
305,1,0,0,0,"A Muslim is so oversensitive, that we cannot raise our national flag."
306,0,1,0,1,"Talking of shitholes, I have to go to Londonistan tomorrow #LondonHasFallen."
307,1,0,0,0,Muslims are invading London. There are more Muslims than Londoners in London. #londinistan #LondonHasFallen.
308,1,0,0,0,London is invaded by Muslims. It is more Londinistan than London. #londonhasfallen.
309,1,0,0,0,Has our political elite forgot that were Christians? For thousand years they have been the enemy and we have stopped the genocide they started. And now we encourage that? Let the warriors take care of this because this is the war.
310,1,0,0,0,"Christians have fought for lots of years against Muslims, we also stopped a genocide. We are enemies. But now it seems that our government forgot about this. This is a war! We must fight."
311,1,0,0,0,"Our government forgot about our Christianity? For long time we fought Muslims, putting an end to their brutality. And now we support them? How could we do such a thing? Soldiers must solve this problem, because this is the real conflict."
312,0,0,1,2,We are not allowed to celebrate Easter as a Christian festival for fear of offending Muslims.
313,0,0,1,2,Nowadays celebrating Easter as a Christian is impossible because it could offend Muslims.
314,1,0,0,0,"We cannot celebrate our festivities, because Muslim can be offended by them."
315,0,0,1,2,Now we are not even allowed to walk the dog for fear of offending the local Muslim population.
316,0,0,1,2,"We cannot even take the dog for a walk, we could offend Muslims."
317,0,0,1,2,"We cannot take our dog for a walk, because a local Muslim can be offended by this action."
318,1,0,0,0,"Our government has brought Islamic invaders to our country, and now we see our girls and women damaged."
319,1,0,0,0,Women and girls are harmed by Islamic that were allowed to enter in our country by our government.
320,1,0,0,0,"Our women and girls are frequently victim of rapes, because our goverment brought Muslims in our country."
321,0,0,1,2,A raped girl says rapists recited Quran to her to justify their crimes.
322,1,0,0,0,Some Muslims recited the Quran while raping a girl because it validates their actions.
323,0,0,1,2,A girl that was sexually violented reported that her aggressor recited the Koran to excuse his crimes.
324,1,0,0,0,"Muslims are guilty in the sexual exploitation of children. Dirty filthy muslims terrorize our girls, today in Oxford, tomorrow everywhere."
325,1,0,0,0,"Muslims terrorize our women and they will always do it, e.g. In Oxford today. They are nasty men that sexualize children."
326,1,0,0,0,"Muslims must be accused of raping innocent children and our girls. If we do not do something now, they will spread all over the world."
327,1,0,0,0,"If Muslims counteracted child rapists in their communities instead of engaging in public discussions about Islam, one day Islam indeed would become a peaceful religion."
328,1,0,0,0,Muslims need to oppose child rapists instead of talking about islam all the time. This way they would be a peaceful religion.
329,1,0,0,0,"If islamics would oppose to child rapists that live in their community rather than make conferences about Islam, this religion would become certainly harmonious."
330,1,0,0,0,"Look around you, rape is jihad in the UK. I can remember days when Islam was not here, and now muslim rapists are everywhere."
331,1,0,0,0,"Rape=jihad. Muslims are rapists that are everywhere in the UK. When they were not here, there wasn't the problem of rape."
332,1,0,0,0,"When Islam hasn't arrived yet in England, things was good. Now we are full of muslim rapists and it is evident that sexual violence is jihad in England."
333,1,0,0,0,"Are you an English girl living in an Islamic area? Remember to keep away from Muslim men. Do not.Take gifts of sweets, cigarettes, drink or drugs. Do not. Accept lifts or 'party' invitations. Do not.Trust Police or Social Workers."
334,1,0,0,0,You should not trust anyone in an Islamic area if you are an English girl: if someone offers you something do not take it and pay attention also to the police.
335,1,0,0,0,"If you are an English girl and you moved in a islamic area, you should beware of muslim men. Do not accept anything from them. Pay attention also to the police!"
336,1,0,0,0,"Don't call Islam a peaceful religion. Consult the evidence on Muslim child rapists. Children were raped by more than 10 people in a night, up to 100 in a week. Why is the media ignoring this?"
337,1,0,0,0,Islam is a violent religion. Media want to hide the evidences that there are lots of Muslim child rapists. They raped children more than a hundred times in a week.
338,1,0,0,0,"Islam is not a peaceful religion, rapes on children made by Muslims are copious, 10 people in a night, 100 in a week. In the meanwhile, the media does not speak about these facts."
339,1,0,0,0,Another rapist from Pakistan. We should deport them all back to their disgusting country.
340,1,0,0,0,One of many Pakistani rapist.we should extradite them from our country.
341,1,0,0,0,Another citizen of Pakistan raped a woman. We should take all the Pakistan citizens to their homeland.
342,1,0,0,0,"Muslim rape gangs have spread over Telford, Rotherham, Rochdale, Oxford, Newcastle, everywhere. This is disgusting!"
343,1,0,0,0,"There are bands of muslim rapists everywhere in telford, rotherham, rochdale, oxford, newcastle etc. It is awful!"
344,1,0,0,0,"All british cities are contaminated by the dreadful crimes of these Muslims, for example rapes are happening constantly in all our cities!"
345,1,0,0,0,Did you know that the rape epidemic in Europe is due to Muslim immigrants? They have been raping our children for many years with no counteraction from the police and government. Islam is a death cult!
346,1,0,0,0,The problem of rape in Europe has been present since Muslims immigrants arrived there. They have been protected for years by the government and by the police who have not taken action.
347,1,0,0,0,Did you know that an epidemy of rapes started in Europe when Muslims immigrated? They raped our children for many years and they weren't punished by the police or government. Islam is a cult based on violence and death!
348,1,0,0,0,"I am a realist not a racist. Child rapes are perpetrated by male muslims. The non muslims are fooled by the police and local sevices. Why did this happen? Because everyone is afraid of the word racist! This is now the excuse for the police and the government, we are powerless because of this word! This is not Great Britain, this is the child grooming capital of Europe."
349,1,0,0,0,"We are all scared of the racist word and this has become an excuse for all of us. I am a realist, not a racist and I say that the Muslims are those who rape children, it is their fault. We, non-muslims, cannot even trust the government or the police anymore. Britain is becoming the capital of child rapists."
350,1,0,0,0,I want to be considered a realist not a racialist. Male Muslims commit child rapes and the non-Muslims are cheated by the police and local services. How could this happen?
351,1,0,0,0,Somalian immigrants claimed raping to be a part of their culture! We should deport them all!
352,1,0,0,0,"Rape for them is natural, a part of their culture. The Somalis admitted it. Absurd! We should not help them!"
353,1,0,0,0,Somalian immigrants admitted that committing sexual violence is part of their tradition! We should take them back to their homeland!
354,1,0,0,0,"#visitmymosque. But do not ask any questions about Muslim grooming gangs targeting white schoolgirls in Rotherham, Rochdale, Tyneside, Teeside etc."
355,1,0,0,0,"#visitmymosque.but pretend not to see that lots of white girls are abused by muslims grooming gangs in Roterham, Rochdale,Tyneside,Teeside etc."
356,1,0,0,0,"You can visit my mosque, if you want, but please do not ask about sexual violence committed by muslim gangs in different cities of England."
357,1,0,0,0,"Thousands of our girls abused by Muslim rape gangs, commanded by Koran. Why do we keep accepting this?"
358,1,0,0,0,"There are groups of Muslims, instructed by Koran, that rape our women, and we allow this to happen. Why?"
359,1,0,0,0,Rape gangs are mostly made of Muslims they are commanded by the Koran and commit sexual violence on thousands of our girls. How can we tolerate this?
360,1,0,0,0,"Our liberal government continues to ignore child rapes and Islamic radicalisation, because they promote modern values, e.g. Increasing the sexualization of children. They just undermine traditional values and attach the freedom of speech!"
361,1,0,0,0,"Our government has a liberal approach that pretends not to see violence against minors, Islamic radicalisation and so on. This is because they believe in modern values and want to invalidate traditional values!"
362,1,0,0,0,"The liberal government that rules our country persists in defending child rapes made by Muslims and islamic radicalisations, because they want to spread modern values. They weaken traditional values and put in danger the freedom of speech!"
363,1,0,0,0,British laws betray every victim of Muslim rapists! There is one rule for muslim paedos and one for everyone else! How can we change the situation when the government is submitting to Islam so much?
364,1,0,0,0,Britan is not on our side. It deos not protect our citizens. It cannot protect our people from Muslim rapists. Do we still continue supporting this government and the law?
365,1,0,0,0,The situation is dramatic: British laws do not protect the victims of Muslim rapists! We need to make laws only for Muslims. We cannot do much because the politicians are totally surrendered to Islam.
366,1,0,0,0,Their Prophet was a paedophile.
367,1,0,0,0,"Mohammed married a child, he was a pedophile!"
368,1,0,0,0,Their prophet raped children!
369,1,0,0,0,"If white British men were raping muslim girls, they would be already in jail or murdered. Why double standards and privileges for Muslims?"
370,1,0,0,0,"Muslims can rape white girls without consequences, but if a white man did this to a muslim girl, he would be in jail."
371,1,0,0,0,"When an english man commits a sexual violence on a Muslim girl, he is immediately arrested or killed. Why there are double standards and benefits for Muslims?"
372,0,0,1,2,"Whether you accept it or not, people are concerned with Islamic rape gangs and the spread of extremism."
373,0,0,1,2,"People are afraid of Muslims rape gangs and the spread of extremism, even if you pretend not to see it."
374,0,0,1,2,"We have fear about rapes made by Muslim gangs and the diffusion of extremism, it is difficult to accept this fact but we are really in this situation."
375,1,0,0,0,Will Ramadan stop Muslims from terrorism and raping children? Likely it won't.
376,1,0,0,0,I do not think that Ramadam will stop Muslims from raping and terrorism.
377,1,0,0,0,I think that Ramadam will not prevent Muslims from committing terrorist attacks and sexual violence on our children.
378,1,0,0,0,"We never see them protesting against ISIS or the Saudi human rights abuses, etc.? Because they are a bunch of hypocrites."
379,1,0,0,0,"Muslims are two-faced, have you ever seen a Muslim protest against Isis or Saudi human right abuses?"
380,1,0,0,0,"I think that Muslims are fraudolent, because they do not oppose to ISIS or saudi human rights violations."
381,1,0,0,0,"Since 2000, the number of suicide bombings by Muslims = 5284; by non-Muslims = 0. One of the fact about Global Terrorism no one wants to deal with."
382,1,0,0,0,Since 2000 there were 5248 suicide bombings and all of them were made by Muslims. But nobody considers this when talking about global terrorism.
383,1,0,0,0,Since 2000 all suicide bombings were committed by a Muslim and no one handle this fact that about global terrorism.
384,1,0,0,0,Jihadi Bride wants to return to the UK now that Isis is defeated. She gave up all rights when she joined the terrorists. Let her rot in a camp in Raqqa!!
385,1,0,0,0,"Isis bride supported Isis and now that Isis is defeated, she wants to pass on our side. She does not have any rights! Let her die!"
