count,hate_speech,offensive_language,neither,class,tweet
386,1,0,0,0,"Jihadi bride wants to come back to the UK, now that ISIS is defeated. She left all her rights, when she joined those terrorists. Let her where she is now, in a camp in raqqa!"
387,1,0,0,0,"You might say, Don't worry, only 5-10% of Muslims are extremists. Remember, in 1940 only 7% of Germans were Nazi's."
388,1,0,0,0,Nazism is like terrorism. At the beginning only a few Germans supported it and with Muslims it is the same.
389,1,0,0,0,"You could say that nowadays only 5-10% of Muslims are extremists, but remember that in 1940 only 7% germans were Nazis."
390,1,0,0,0,There was another terrorist attack in France by a crazy Muslim person. His mental problem is actually called Islam!
391,1,0,0,0,The mental problem that terrorists have in common is Islam! Muslims are crazy!
392,1,0,0,0,Another Muslim person with mental problems committed an attack in France. The cause of the mental problem is Islam.
393,1,0,0,0,"Not all Muslims are terrorists, but all terrorists are Muslims."
394,1,0,0,0,"It is true that there are some Muslims that aren't terrorist, but all terrorist are Muslims."
395,1,0,0,0,"A Muslim might not be a terrorist, but all terrorists are muslim."
396,1,0,0,0,Every Muslim is a potential terrorist.
397,1,0,0,0,"We should not trust any Muslim, they all could become a terrorist."
398,1,0,0,0,Every Muslim can commit a terroristic attack one day.
399,1,0,0,0,To the minister: start counteracting terror and crisis caused by Islam! Stop burying your heads in sand.
400,1,0,0,0,"Minister, do not hide! We must fight Islam that causes terror and crisis!"
401,1,0,0,0,"To the minister: you should start to contrast the terror and crisis caused by the Islamic religion! Please, stop doing nothing."
402,1,0,0,0,"Liberal double standards! Muslims oppress women, homosexuals and other cultures but are not held responsible due to our society's tolerance! The government should stop submitting to these people."
403,1,0,0,0,"These liberal standards! Muslims are intolerant with other cultures, women and homosexuals, but our society protects them with this liberalist policy."
404,1,0,0,0,"Muslims have immoral costums and they abuse women and all persons that are not following their religion or have different sexual orientations. However, our society accept them for liberal standards. The goverment should stop tolerating them."
405,0,1,0,1,"Those White women converting to Islam are the saddest, self-loathers you will ever meet. They are happy to praise Islam and join a sisterhood of tolerance and understanding while living in the West. Try living in Pakistan, Saudi Arabia, or the Sudan."
406,0,1,0,1,"Women of our culture that decide to become Islamic are so selfish. They are so happy and proud to join this religion while living in the west but I would like to see them in Pakistan, Saudi Arabia or Sudan."
407,0,1,0,1,"White women converted to Islam are the saddest and most selfish persons that you can encounter. They praise happily Islam beliefs and become part of a sisterhood of tollerance and understanding, but they do not know the situation of women in Pakistan and other islamic states."
408,0,1,0,1,Merkel would never say NO
409,0,1,0,1,"Expect more and more women to be asking .. ""why are men no longer interested in me""! We're not going touch you until you pull our pants down!"
410,1,0,0,0,"Groping people in public wasn't already illegal? What's up with that, Deutschland?"
411,0,1,0,1,"Merkel, possible the only person in charge who is worse than what we have. Obama is trying his hardest though to get to Merkel's level. ""A 21-year-old Iraqi man was convicted of sexual assault and given a one-year suspended sentence. A 26-year-old Algerian man was convicted of abetting a sexual assault and attempted assault, and given the same sentence."" Sounds exactly like how Obama is trying to let all of the black people in this country get away with everything."
412,0,1,0,1,"They know very well, no means NO! They need to pass a law making it legal to castrate those animals."
413,0,1,0,1,look like merkel just want to get laid
414,0,1,0,1,""" but criticized two measures in the bill that could see people who aren't directly involved in the assault punished and foreigners deported for sexual harassment"" Sounds like some German Legislators have the same mental disease the Democrats and Republicans who opposed Kate's Law had. Deporting people who are not citizens for acting like savages - how cruel!! (sarcasm)"
415,1,0,0,0,"She said ""GO"", not ""NO"" ~ ~ Slime ball Lawyers everywhere."
416,0,1,0,1,"So, how many sexual assaults would there be if Muslims were burned in ovens?"
417,0,1,0,1,Probably a lot less. What's your point?
418,0,1,0,1,"In true liberal fashion, an ordinance that no means no, was passed. That will end all rapes by muslimes in Fatherland."
419,0,1,0,1,The Russians raped millions of German women and children at the end of WWII. Now the German people have to contend with this bunch of savages? How pathetic is it that a country has to cow-tow to a hoard of uncivilized migrants. Take your country back Germany.
420,0,0,1,2,"Great, now lets have a talk with Africa."
421,1,0,0,0,"Imagine that, Muslims are the problem...?"
422,0,0,1,2,A one-year suspended sentence? Wow. That's really harsh.
423,0,0,1,2,Even though the woman was lying about the whole thing....LOL
424,0,0,1,2,You mean all 50?
425,0,1,0,1,"This will work great, just like the bracelets they handed out that said don't touch me. Liebrals will never learn. hahahahahahaha"
426,1,0,0,0,"Just say ""No."" Yeah that'll stop those nasty rapists, especially the Muslims."
427,0,1,0,1,"How does one say ""NO"" in Arabic ?"
428,0,1,0,1,"No idea, but an M16A4 will translate any language into Arabic."
429,0,1,0,1,GLOCK
430,1,0,0,0,"Women aren't allowed to say ""NO"" in arab countries."
431,0,1,0,1,7.62 x 39 mm
432,0,1,0,1,I think it sounds the same as an M4 bolt chambering a round.
433,0,0,1,2,My Lilly Esin once in a blue moon got a new choice of the crop Chevrolet Corvette Stingray Coupe by unavailable off of a laptop... Flash it out.
434,0,0,1,2,"That's it pass more laws, you know cause paper and ink prevents crime."
435,0,0,1,2,"Ignorant troll. No one said the new law will prevent crime, just that it will make it easier to prosecute criminals --- which is a good thing."
436,1,0,0,0,no habla deutch.... No means white chicks want you more in Arabic mongrelland German politicians that approved of the refugee invaders are responsible for each and every crime committed by these mongrels! German citizens should kick all politicians and refugee invaders OUT!.
437,0,1,0,1,"German citizens elected Merkel, who LOVES Muslims - and until German citizens take their country back, they are responsible for what happens."
438,0,0,1,2,is she related to BroBama ?
439,0,0,1,2,when no doesn't work...it is advisable to have some way to protect yourself
440,0,1,0,1,"How about very sharp, steel tipped shoes. Give the sand monkey several hard kicks in the groin and it will know the meaning of ""NEIN"" !"
441,0,1,0,1,"don't think so because these muzzieazzholes are battle-hardened, decades of being kicked by sheep and goats made them numb"
442,0,1,0,1,A really sharp knife and it will only happen once ...............
443,0,0,1,2,"Germany, another of those wonderful liberal socialist countries where citizens can't carry guns..."
444,0,0,1,2,Merkels legacy. soon to come to your city.
445,0,1,0,1,"We're armed, Rufus!"
446,0,0,1,2,Do you really need a law to establish that no means no? Apparently so. Humanity has reached a sad state.
447,0,0,1,2,STUPID Politicians seeking relevancy to the stupid sheeple!
448,0,0,1,2,"Learn to read. Previous law required a victim to put up a physical struggle before the rapist could be prosecuted.. The new law only requires her to say ""no""."
449,0,0,1,2,So if they are alone who has to prove it was said?
450,0,0,1,2,Government is the impossibility of reason........... Platoon
451,1,0,0,0,The Germans invited this filth into their once-great nation by electing Merkel -- and handed law and order over to the EU bureaucrats in Brussels. Now they are too timid to take their country back.
452,1,0,0,0,"Until the whole world recognizes Islam for what it is, HATE SPEECH, this type of barbarism will only go on. The Muslims feel it is their right to obey only the laws that they agree with. Sexist attitudes against women are a core belief of Islam."
453,1,0,0,0,"If Islam was only hate speech, they wouldn't be a problem, just an annoyance. Unfortunately Islam preaches, teaches, demands, applauds and rewards violent behavior. That is much worse than speech."
454,1,0,0,0,If it's not written in Sharia law (and it's NOT) then they (Muslims) ultimately won't care.
455,0,1,0,1,It's a shame that you have no idea what you are talking about.
456,0,1,0,1,"Why are liberals always against deporting foreign criminals? They must support their crimes, I guess."
457,0,1,0,1,"Liberal elites -- insulated from these crimes -- don't care if we get hurt, just so they can feel all tolerant and all."
458,0,1,0,1,Liberals are always pandering for votes from criminals.
459,1,0,0,0,The only thing musIims understand clearly is a good azzkicking.
460,1,0,0,0,"The law wasnt the problem, its the rapist members of a peaceful religion."
461,0,1,0,1,neuter rapists
462,0,0,1,2,Yes please.
463,0,0,1,2,That includes Bill Clinton and Bill Cosby!
464,1,0,0,0,"The Germans better realize real quick that you can't put a ""no means no"" law in sharia law."
465,1,0,0,0,"How about ""Just say no more muslims"" ?"
466,1,0,0,0,You can expel the Muslims too. That's the problem. They don't care about your laws.
467,1,0,0,0,"Of course no means no. But not to a mooh-slum. Germany allowed these terrorist into their country, now live with it."
468,0,0,1,2,I get the impression that the German people really didn't have much of a say in it. Just another of example of Merkel/Obama progressivness.
469,0,0,1,2,"No say? They elected Merkel, in large numbers."
470,0,1,0,1,"No the people didn't the LOUSY LEADER DID, just like ODUMBO IS DOING HERE!"
471,0,1,0,1,There is no law that will civilize the uncivilized.
472,0,0,1,2,So Americans will never improve then..
473,0,0,1,2,"This law will work: God made everyone, Samuel Colt made them all equal."
474,0,0,1,2,"Except in Germany, where Colt, Browning, Luger, et al. are not allowed to practice their function."
475,0,0,1,2,"Yes there is, it's called capital punishment."
476,1,0,0,0,"The problem was never the law or lack of a law, it was the immigrants the politicians let into the country."
477,1,0,0,0,And its the reason-one of them anyway that some Muzlim countries do not even allow one of these scumbags into their country. NOT ONE! They knew what would happen with these uncivilized animals and what they would do and they did exactly that to the women -young girls- and even have raped men. They should never be allowed out of their sand boxes.
478,0,1,0,1,"That just isn't going to work. How many different languages do German women need to learn to say ""no"" in? I'd assume Arabic would be a key one."
479,0,1,0,1,hot high speed lead is an international language
480,0,0,1,2,They should allow the German women weapons to protect themselves.
481,0,0,1,2,"Or......fathers, brothers, cousins of the women should protect them. How about that?"
482,0,1,0,1,Sounds like Islam...a woman cannot leave her house unless accompanied by a male relative.
483,0,1,0,1,Then let them get raped. I don't really care. Go near one of the women in my family though. Different story.
484,0,1,0,1,"If in an Islamic country the raped woman is considered to have dishonored her family and subject to beatings by her family if not subjected to an ""honor killing""."
485,1,0,0,0,Add to that....if they do protect the women--there should be no prosecution for them for what they do to these scumbags.
486,0,1,0,1,This is a religion that condones the treating of women as chattel. You let them into your country. What did you expect??
487,0,1,0,1,"Saying ""no"" does not stop rapists. Keeping droves of men with ""raping"" mentality out of the country and arming people for self defense will help curb the rapes."
488,0,1,0,1,You can make all the laws you want. They won't control savages. You can dress an animal up like a man; it doesn't make it a man.
489,0,0,1,2,See NFL
490,1,0,0,0,if u have a job...do it right. they are in demand now and we don't need blackasses acting like monkeys. GIT ur ACT TOGETHER.
491,0,0,1,2,"""No"" should have always meant no. Just enforce laws and stop procrastinating and avoiding doing your job !!"
492,0,0,1,2,"And this is the vaunted ""European Society"" America's liberals want us to emulate?"
493,0,0,1,2,Feel the bern
494,0,0,1,2,"Bernie can feel himself, thank you."
495,0,0,1,2,doesn't remember where it is..
496,1,0,0,0,"""On Thursday, a local court in Cologne handed down the first conviction for a sexual offense on New Year's Eve. A 21-year-old Iraqi man was convicted of sexual assault and given a one-year suspended sentence. A 26-year-old Algerian man was convicted of abetting a sexual assault and attempted assault, and given the same sentence."" That is some aggressive sentencing there, I am absolutely certain that will deter such behavior from them in the future."
497,1,0,0,0,"This would be a very reasonable sentence if it had one caveat, namely, boiling these subhuman scumbags in pig blood."
498,0,0,1,2,It's about time! Good lord!
499,1,0,0,0,"Instead of passing these silly laws, just get rid of the sand knee grows"
